{
  "repo": "payments-api",
  "phase": "P1",
  "findings": [
    {
      "evidence": "TblPayment migration defines status enum",
      "conclusion": "payments-api owns payment status",
      "confidence": "HIGH"
    }
  ],
  "open_questions": [],
  "conflicts": [],
  "files_read": ["db/migrations/001_payments.sql"]
}
